{
  "$schema": "http://json-schema.org/draft-07/schema#",
  "type": "object",
  "properties": {
    "fingerprint": {
      "type": "string",
      "pattern": "^([A-F0-9]{32}|[A-F0-9]{40}|[A-F0-9]{64})$",
      "description": "Valid GPG fingerprint length (128-bit v3, 160-bit v4, or 256-bit v6), uppercased"
    },
    "label": {
      "type": "string",
      "description": "The label or name associated with the individual or entity, typically matching the name on the GPG key."
    },
    "validity": {
      "type": "string",
      "enum": [
        "full",
        "marginal",
        "revoked",
        "none"
      ],
      "description": "The validity level of the identity assertion. Indicates how thoroughly the identity has been verified.",
      "example": "full"
    },
    "refs": {
      "type": "array",
      "minItems": 2,
      "items": {
        "type": "object",
        "properties": {
          "date": {
            "type": "string",
            "format": "date",
            "description": "The date when the verification or cross-signing took place, in YYYY-MM-DD format."
          },
          "comment": {
            "type": "string",
            "description": "A brief description of what the reference verifies or supports (e.g., project affiliation, key ownership)."
          },
          "artifact": {
            "type": "string",
            "description": "A cryptographic artifact (i.e. clearsigned message) demonstrating possession of a specific key (i.e. signing subkey)"
          },
          "url": {
            "type": "string",
            "format": "uri",
            "description": "A URL pointing to an authoritative source or resource that validates the reference."
          },
          "dns": {
            "type": "string",
            "pattern": "^[A-Za-z0-9]+\\._openpgpkey\\.[A-Za-z0-9]([A-Za-z0-9-]{0,61}[A-Za-z0-9])?(\\.[A-Za-z0-9]([A-Za-z0-9-]{0,61}[A-Za-z0-9])?)*$",
            "description": "Valid DNS domain name consisting of one or more labels (separated by dots), with each label containing only letters, numbers, and hyphens, and no label being longer than 63 characters. Provided for OPENPGPKEY DNS resource records (https://datatracker.ietf.org/doc/html/draft-ietf-dane-openpgpkey-06#section-2)."
          },
          "type": {
            "type": "string",
            "enum": [
              "role",
              "user",
              "key"
            ],
            "description": "The type of verification or evidence provided. 'role' is for project affiliation, 'user' signifies independent key ownership verification, and 'signature' indicates submission from private key holder"
          }
        },
        "required": [
          "date",
          "comment",
          "type"
        ],
        "additionalProperties": false
      },
      "description": "A list of references that provide evidence to support the identity assertion. Each reference must include a date, comment, and type."
    },
    "tags": {
      "type": "array",
      "items": {
        "type": "string",
        "description": "A list of tags or labels that categorize or identify the individual or entity (e.g., 'OWASP', 'developer')."
      },
      "description": "Tags associated with the identity, which help categorize or identify the individual or entity."
    }
  },
  "required": [
    "fingerprint",
    "label",
    "validity",
    "refs",
    "tags"
  ],
  "additionalProperties": false
}