{
  "fingerprint": "99BB608E30380C451952D6BBA1C7E813F160A407",
  "label": "Matt Borja",
  "validity": "full",
  "refs": [
    {
      "date": "2024-11-27",
      "comment": "Signed artifact demonstrating private key use: `echo -n '3ED3 3CCE 4BED 165C 9107 3D9F 65B8 8DAC 23AF 5BCD E520 F723 C1E6 2A69 B369 F278' | gpg --clearsign --local-user D41A83E1C6B701619D0D812FC3F69D1BE6BCBD16`",
      "artifact": "-----BEGIN PGP SIGNED MESSAGE-----\nHash: SHA512\n\n3ED3 3CCE 4BED 165C 9107 3D9F 65B8 8DAC 23AF 5BCD E520 F723 C1E6 2A69 B369 F278\n-----BEGIN PGP SIGNATURE-----\n\niHUEARYKAB0WIQTUGoPhxrcBYZ0NgS/D9p0b5ry9FgUCZ0dD0AAKCRDD9p0b5ry9\nFvonAQCHwAHRduopWn8I534GNRXQ0+dX5JO2ztnFxnlwZd+NMAD/Wr0NWLEc+eCf\nQm2UHkDp8lKswj6kXxTi9GI3elvpQgE=\n=L95q\n-----END PGP SIGNATURE-----\n",
      "type": "key"
    },
    {
      "date": "2024-10-06",
      "comment": "Cross-signed by F30FF4FC936584574EE3251833688C2EDC08CD38",
      "type": "user"
    },
    {
      "date": "2025-01-17",
      "comment": "Listed on LinkedIn profile as Download Public PGP Key link",
      "type": "user",
      "url": "https://www.linkedin.com/in/mattborja"
    },
    {
      "date": "2025-01-17",
      "comment": "LinkedIn profile showing identity verification by CLEAR using government ID",
      "type": "user",
      "url": "https://www.linkedin.com/help/linkedin/answer/a1359065"
    },
    {
      "date": "2025-01-01",
      "comment": "Industry certification requiring strong identity verification during proctored high stakes exam with Global Information Assurance Certification (https://www.giac.org/knowledge-base/proctor/)",
      "type": "user",
      "url": "https://www.credly.com/badges/c0ee1538-53dd-43a0-bf9e-7724e374ff43"
    },
    {
      "date": "2025-01-01",
      "comment": "Credly profile showing both user photo and industry certification with link to ORCiD profile (https://orcid.org/0009-0008-5528-9362)",
      "type": "user",
      "url": "https://www.credly.com/users/mattborja"
    },
    {
      "date": "2025-01-01",
      "comment": "OrciD profile referenced by Credly profile listing verified email domains, websites, social links, and GPG fingerprints in Keywords section using Uniform Resource Name format: urn:identity:gpg:<fingerprint>",
      "type": "user",
      "url": "https://orcid.org/0009-0008-5528-9362"
    }
  ],
  "tags": [
    "Self",
    "HSM"
  ]
}
